{
  "version": 1,
  "defaults": {
    "tier": "normal",
    "authority": "commit"
  },
  "verifiers": [
    "package.json",
    ".github/workflows/validate.yml"
  ],
  "paths": {
    "plugin/skills/devanity/**": {
      "tier": "normal",
      "check": "node scripts/validate.mjs",
      "invariants": [
        "one grammar, one file",
        "a mode loads only its Load: line"
      ]
    },
    "plugin/skills/devanity/SKILL.md": {
      "tier": "normal",
      "core": true,
      "check": "node scripts/kernel.mjs invariants && node scripts/kernel.mjs check-agents",
      "purpose": "the kernel, paid on every turn",
      "invariants": [
        "Decisions order is measured law",
        "AGENTS.md is generated from it"
      ]
    },
    "plugin/agents/**": {
      "tier": "normal",
      "check": "node scripts/kernel.mjs check-agents",
      "invariants": [
        "the worker collects evidence and never judges",
        "the verifier falsifies and never edits"
      ]
    },
    "plugin/hooks/**": {
      "tier": "high-risk",
      "check": "node --test tests/*.test.mjs",
      "purpose": "plugin runtime in every user's session",
      "invariants": [
        "failure paths allow and leave a trace",
        "only /devanity decide writes by: human",
        "the oracle runs only checks declared at HEAD"
      ]
    },
    "scripts/**": {
      "tier": "high-risk",
      "check": "npm test && node scripts/validate.mjs",
      "purpose": "the repository validator, the AGENTS.md generator, and the old path of the reference CI job (a shim)",
      "invariants": [
        "dependency-free"
      ]
    },
    "plugin/scripts/**": {
      "tier": "high-risk",
      "check": "node --test tests/rules-ci.test.mjs tests/scripts.test.mjs",
      "purpose": "the reference CI job and the computations the modes run (hotspots, calibrate)",
      "invariants": [
        "dependency-free",
        "observation never changes the verdict"
      ]
    },
    ".claude-plugin/**": {
      "tier": "high-risk",
      "check": "node scripts/validate.mjs",
      "purpose": "the marketplace: it installs plugin/ and nothing else"
    },
    "plugin/.claude-plugin/**": {
      "tier": "high-risk",
      "check": "node scripts/validate.mjs"
    },
    "plugin/templates/**": {
      "tier": "high-risk",
      "check": "node --test tests/rules-ci.test.mjs",
      "purpose": "the consumers' reference CI job, copied by init"
    },
    "evals/harness/**": {
      "tier": "normal",
      "check": "python3 evals/harness/run.py --selftest",
      "purpose": "the harness: arms, tasks, AXES, scorers, judges",
      "invariants": [
        "every scorer proven by good and bad references",
        "ported tasks byte-identical"
      ]
    },
    "evals/results/**": {
      "tier": "trivial",
      "purpose": "dated writeups, never edited to match a later run"
    },
    "docs/**": {
      "tier": "trivial",
      "purpose": "the hooks reference, and the maintainer's SPEC and PLAN (Portuguese)"
    },
    "README.md": {
      "tier": "trivial"
    }
  },
  "autonomy": {
    "authority": "commit",
    "high-risk": "queue",
    "irreversible": "queue"
  }
}
